{
  "$schema": "../../registry.schema.json#/properties/plugins/items",
  "id": "billing-plugin",
  "name": "Billing",
  "author": "TimeTracker",
  "repository": "https://github.com/bthos/time-tracker-billing-plugin",
  "latest_version": "1.0.0",
  "description": "Billable time tracking plugin. Mark categories as billable, set hourly rates, and calculate billable hours and revenue across projects.",
  "category": "productivity",
  "verified": true,
  "downloads": 0,
  "tags": ["billing", "revenue", "hourly-rate", "billable"],
  "license": "MIT",
  "min_core_version": "0.2.7",
  "api_version": "1.0"
}
