{
  "$schema": "https://github.com/tmtrckr/plugins-registry/schemas/manifest.schema.json",
  "id": "example-plugin",
  "name": "Example Plugin",
  "author": "Developer Name",
  "repository": "https://github.com/user/plugin-example",
  "latest_version": "1.0.0",
  "description": "This is an example plugin for the Time Tracker plugins registry. Demonstrates the folder structure with author grouping.",
  "category": "integration",
  "verified": false,
  "downloads": 0,
  "tags": ["example", "plugin", "time-tracker"],
  "icon": "https://raw.githubusercontent.com/user/plugin-example/main/icon.png",
  "homepage": "https://github.com/user/plugin-example",
  "license": "MIT",
  "min_core_version": "0.3.0",
  "max_core_version": "1.0.0",
  "api_version": "1.0"
}
